[
  {
    "id": "pe_breakfast_pan_palta_huevo_001",
    "image_path": "images/pe_breakfast_pan_palta_huevo_001.jpg",
    "ground_truth": {
      "kcal": 420,
      "protein_g": 17.0,
      "carbs_g": 38.0,
      "fat_g": 22.5,
      "ingredients": [
        { "name": "pan integral", "portion_g": 60 },
        { "name": "palta", "portion_g": 70 },
        { "name": "huevo sancochado", "portion_g": 55 }
      ],
      "region": "pe",
      "meal_time": "breakfast"
    },
    "tolerance": { "kcal_pct": 0.15, "macro_pct": 0.20 },
    "notes": "Desayuno peruano clasico. Tolerancia estandar."
  },
  {
    "id": "mx_lunch_tacos_pastor_002",
    "image_path": "images/mx_lunch_tacos_pastor_002.jpg",
    "ground_truth": {
      "kcal": 680,
      "protein_g": 32.0,
      "carbs_g": 58.0,
      "fat_g": 32.0,
      "ingredients": [
        { "name": "tortilla de maiz", "portion_g": 90 },
        { "name": "carne al pastor", "portion_g": 140 },
        { "name": "pina", "portion_g": 30 },
        { "name": "cebolla", "portion_g": 20 },
        { "name": "cilantro", "portion_g": 5 }
      ],
      "region": "mx",
      "meal_time": "lunch"
    },
    "tolerance": { "kcal_pct": 0.15, "macro_pct": 0.20 },
    "notes": "3 tacos pastor con guarniciones tradicionales."
  },
  {
    "id": "ar_dinner_milanesa_pure_003",
    "image_path": "images/ar_dinner_milanesa_pure_003.jpg",
    "ground_truth": {
      "kcal": 750,
      "protein_g": 42.0,
      "carbs_g": 55.0,
      "fat_g": 36.0,
      "ingredients": [
        { "name": "milanesa de ternera", "portion_g": 180 },
        { "name": "pure de papa", "portion_g": 200 },
        { "name": "aceite girasol", "portion_g": 10 }
      ],
      "region": "ar",
      "meal_time": "dinner"
    },
    "tolerance": { "kcal_pct": 0.18, "macro_pct": 0.22 },
    "notes": "Milanesa frita amplia variabilidad en absorcion de aceite; tolerancia ligeramente mas amplia."
  },
  {
    "id": "co_snack_arepa_queso_004",
    "image_path": "images/co_snack_arepa_queso_004.jpg",
    "ground_truth": {
      "kcal": 290,
      "protein_g": 11.0,
      "carbs_g": 32.0,
      "fat_g": 13.0,
      "ingredients": [
        { "name": "arepa de maiz", "portion_g": 100 },
        { "name": "queso campesino", "portion_g": 30 }
      ],
      "region": "co",
      "meal_time": "snack"
    },
    "tolerance": { "kcal_pct": 0.15, "macro_pct": 0.20 },
    "notes": null
  },
  {
    "id": "br_lunch_feijoada_005",
    "image_path": "images/br_lunch_feijoada_005.jpg",
    "ground_truth": {
      "kcal": 820,
      "protein_g": 45.0,
      "carbs_g": 72.0,
      "fat_g": 35.0,
      "ingredients": [
        { "name": "frijol negro", "portion_g": 180 },
        { "name": "carne de cerdo", "portion_g": 100 },
        { "name": "linguica", "portion_g": 60 },
        { "name": "arroz blanco", "portion_g": 120 },
        { "name": "couve", "portion_g": 40 }
      ],
      "region": "br",
      "meal_time": "lunch"
    },
    "tolerance": { "kcal_pct": 0.18, "macro_pct": 0.22 },
    "notes": "Plato compuesto, alta variabilidad de cortes carnicos. Tolerancia ampliada."
  }
]
